<?xml version='1.0' encoding='UTF-8'?>
<!DOCTYPE hibernate-configuration
  PUBLIC "-//Hibernate/Hibernate Configuration DTD//EN"
  "http://www.hibernate.org/dtd/hibernate-configuration-3.0.dtd">
<hibernate-configuration>
  <session-factory>

    <property name="hibernate.javax.cache.provider">org.ehcache.jsr107.EhcacheCachingProvider</property>
    <property name="hibernate.javax.cache.uri">ehcache.xml</property>
    <property name="hibernate.cache.region.factory_class">org.hibernate.cache.jcache.internal.JCacheRegionFactory</property>

    <property name="hibernate.generate_statistics">true</property>
    <property name="hibernate.cache.use_query_cache">true</property>
      
    <property name="connection.driver_class">org.hsqldb.jdbcDriver</property>
    <property name="connection.url">jdbc:hsqldb:mem:cache</property>
    <property name="connection.username">sa</property>
    <property name="connection.password"></property>
    <property name="dialect">org.hibernate.dialect.HSQLDialect</property>
    <property name="connection.pool_size">10</property>
    <property name="show_sql">false</property>
    <property name="hibernate.jdbc.use_streams_for_binary">true</property>
    <property name="hibernate.hbm2ddl.auto">update</property>
    <property name="hibernate.id.db_structure_naming_strategy">legacy</property>
    <mapping resource="hibernate/hsql.hbm.xml" />
  </session-factory>
</hibernate-configuration>
