<?xml version='1.0' encoding='utf-8'?>
<!DOCTYPE hibernate-configuration
  PUBLIC "-//Hibernate/Hibernate Configuration DTD//EN"
  "http://www.hibernate.org/dtd/hibernate-configuration-3.0.dtd">
<hibernate-configuration>
  <session-factory name="java:Pentaho/SessionFactory" >
	<!-- CacheProviderClass -->  
  
    <property name="connection.datasource">Hibernate</property>
    <property name="dialect">org.hibernate.dialect.HSQLDialect</property>
    <property name="transaction.factory_class">org.hibernate.transaction.JTATransactionFactory</property>
    <property name="transaction.manager_lookup_class">org.hibernate.transaction.JBossTransactionManagerLookup</property>
    <property name="show_sql">false</property>
    <property name="hibernate.cache.use_query_cache">true</property>
    <property name="hibernate.generate_statistics">true</property>
    <property name="session_factory_name">hibernate/HibernateFactory</property>
    <property name="hibernate.jdbc.use_streams_for_binary">true</property>
  </session-factory>
</hibernate-configuration>
