<?xml version='1.0' encoding='UTF-8'?>
<!-- ******************************************************************************
 *
 * Pentaho
 *
 * Copyright (C) 2026 by Pentaho Canada Inc. : http://www.pentaho.com
 *
 * Use of this software is governed by the Business Source License included
 * in the LICENSE.TXT file.
 *
 * Change Date: 2030-06-15
 ******************************************************************************* -->
<!DOCTYPE hibernate-configuration
  PUBLIC "-//Hibernate/Hibernate Configuration DTD//EN"
  "http://www.hibernate.org/dtd/hibernate-configuration-3.0.dtd">
<hibernate-configuration>
  <session-factory>

    <property name="hibernate.javax.cache.provider">org.ehcache.jsr107.EhcacheCachingProvider</property>
    <property name="hibernate.javax.cache.uri">ehcache.xml</property>
    <property name="hibernate.cache.region.factory_class">org.hibernate.cache.jcache.internal.JCacheRegionFactory</property>

    <property name="hibernate.generate_statistics">true</property>
    <property name="hibernate.cache.use_query_cache">true</property>

    <!--  Oracle 10g Configuration -->
    <property name="connection.driver_class">oracle.jdbc.driver.OracleDriver</property>
    <property name="dialect">org.hibernate.dialect.OracleDialect</property>
    <property name="hibernate.connection.datasource">java:comp/env/jdbc/Hibernate</property>
    <property name="connection.pool_size">10</property>
    <property name="show_sql">false</property>
    <!-- replaces DefinitionVersionManager -->
    <property name="hibernate.hbm2ddl.auto">update</property>
    <property name="hibernate.id.db_structure_naming_strategy">legacy</property>
    <!-- load resource from classpath -->
    <mapping resource="hibernate/oracle10g.hbm.xml" />
  </session-factory>
</hibernate-configuration>
